,Title,Description,Source,Published At
0,pari vote to crack down on suv,parisian have vote to increas park charg for outoftown suv driver as part of the citi effort to address road safeti air pollut and climat chang,The Verge,2024-02-05T12:24:14Z
1,nasa new mission will studi microscop plankton and aerosol from space,a new nasa mission will studi microscop plant life and particl from space to gather data on climat chang air qualiti and ocean health,The Verge,2024-02-08T19:12:39Z
2,insid the beef industri campaign to influenc schoolchildren,big beef is woo scienc teacher with webinar and lesson plan in an attempt to chang student percept of the industri,Wired,2024-02-01T12:00:00Z
3,whi a suprem court decis on fish boat could chang everyth,the suprem court is pois to gut a key legal doctrin call chevron defer potenti make it harder for feder agenc to regul industri from gun to fossil fuel to broadband,The Verge,2024-01-20T13:00:00Z
4,the fossil fuel industri knew about climat chang sinc 1954,the guardian report the fossil fuel industri fund some of the world most foundat climat scienc as earli as 1954 newli unearth document have shown includ the earli research of charl keel famous for the socal keel curv that,Slashdot.org,2024-02-04T12:34:00Z
5,climat chang crippl panama canal fix it could take year,parch condit have crippl a waterway that handl 270 billion a year in global trade report bloomberg and there are no easi solut the panama canal author is weigh potenti fix that includ an artifici lake to pump water into t,Slashdot.org,2024-01-27T16:34:00Z
6,the world essenti aquif are in deep troubl,new research find that the groundwat system that hydrat your life are in rapid sometim acceler declin around the globe here is how to stop the retreat,Wired,2024-01-24T16:00:00Z
7,your next plane ride could be power by use cook oil here is how a refineri in singapor is alreadi help to make it happen,the vice presid of a renew fuel compani explain how sustain aviat fuel saf will impact aviat and climat chang,Business Insider,2024-02-02T15:54:57Z
8,world first yearlong breach of key 15c warm limit,the last 12 month were the hottest on record temporarili send the world past a deepli symbol mark,BBC News,2024-02-08T03:00:18Z
9,climat denialist find new way to monet disinform on youtub,major of climatedeni content post now doe not violat youtub polici,Ars Technica,2024-01-16T20:19:02Z
10,scientist explor whether to add a categori 6 design for hurrican,climat chang is make power hurrican more common that may requir ad a new offici design for the more intens storm a new studi suggest,NPR,2024-02-06T18:21:48Z
11,scientist say hurrican are grow so power that we need to add a categori 6 here is what that would look like,the hurrican wind speed scale need a new categori 6 scientist say as climat chang intensifi tropic storm here is what that would be like,Business Insider,2024-02-06T22:12:54Z
12,hollywood has been give out climat changefocus award for 33 year who knew,now in it 33rd year the environment media award might be the most celebritystud award ceremoni you have never heard of,NPR,2024-01-27T10:00:35Z
13,climat chang behind africa cholera surg top health offici say,africa top health advisori bodi link the devast cholera outbreak to extrem weather made wors by climat chang,Time,2024-01-31T17:20:24Z
14,2024 must be the year for exponenti climat action,five step to move the world forward on fight climat chang in 2024,Time,2024-01-16T19:17:41Z
15,europ farmer protest eu scrap plan to halv pesticid use,the announc appear to be a concess to farmer who have been protest tighter regul,BBC News,2024-02-06T19:15:42Z
16,the boe 737 max crisi reignit argument over infant safeti on plane,a midair blowout on a boe 737 max 9 show seatbelt matter but infant under two still are not requir to have their own seat expert say chang the rule would make fli safer for childrenbut counterintuit would result in more death,Wired,2024-01-12T17:51:35Z
17,war and climat chang are the main obstacl to aggress fed rate cut in 2024 strategist say,tumult in the middl east and a parch panama canal risk creat pandemiclik suppli shock that could stoke more inflat,Business Insider,2024-01-14T13:15:01Z
18,lauren boebert hot take on the cold weather goe embarrass awri,the colorado republican was school over a climat chang post on x,HuffPost,2024-01-15T07:21:06Z
19,a group of troll genz voter is buy up gop domain,sinc trump and haley will not accur inform young peopl of their view we will,Wired,2024-01-22T14:42:08Z
20,apocalypt optim could be the antidot for climat fatal,if we embrac the realiti that thing will get wors befor they get better we will be equip to fight climat chang,Time,2024-01-24T12:00:00Z
21,whi the war in ukrain is bad for climat scienc,the invas of ukrain hamper collabor with russian climat scientist that is bad news for our collect abil to understand and prepar for a hotter planet,NPR,2024-01-22T16:13:51Z
22,john kerri step down from biden administr,john kerri step down as biden special envoy on climat on saturday,Business Insider,2024-01-14T01:40:14Z
23,ban privat jet and go to a 4day work week are radicaland popular,this stori was origin publish by grist sign up for grist week newslett hereread more,Gizmodo.com,2024-02-02T18:27:00Z
24,john kerri will step down to help biden campaign report,the former secretari of state had been work to fight climat chang as part of the biden administr,HuffPost,2024-01-13T22:35:37Z
25,amazon record drought driven by climat chang,the world largest rainforest protect us from climat chang but deforest has left it vulner,BBC News,2024-01-24T17:37:35Z
26,inequ is a health riskand it is get wors,if not address by govern racism classism auster and more will continu to drive mortal and ill among minor,Wired,2024-01-19T12:00:00Z
27,it is the world biggest elect year is democraci good for climat chang,2024 is the world biggest elect year the need for climat action vs widespread apathi toward it show climat democraci problem,Time,2024-01-11T18:05:29Z
28,earth 20c how to make pass the 15c climat chang threshold an opportun,the realiti is that we may be look at a 20c world that doe not mean we need to give up on fight climat chang,Time,2024-01-22T16:06:16Z
29,crypto mine will have to start report their energi use in the us,the us energi inform administr say it will start a survey of crypto mine electr consumpt follow concern about bitcoin energi hunger and greenhous gas emiss,The Verge,2024-01-31T19:30:56Z
30,at davo conflict climat chang and ai get top bill as leader converg for elit meet,the todo list of global prioriti has grown for this year edit of the world econom forum gabfest that kick off today,Time,2024-01-15T13:40:10Z
31,arnold schwarzenegg detain over eu tax for luxuri watch,the probe for alleg tax evas came as the actor arriv in munich on his way to an auction,BBC News,2024-01-18T10:06:50Z
32,the world has not been this warm in 100000 year,climat scientist were surpris by how high temperatur soar in 2023,Business Insider,2024-01-11T21:36:25Z
33,time and outrid announc new fellowship program to support report on climat chang and the intersect of polit polici and societi,time senior correspond justin worland appoint as fellow today time and the outrid foundat announc a new collabor on a fellowship to support report on climat chang and the intersect of polit polici and societi time senior corr,Time,2024-01-11T18:30:20Z
34,atlant ocean current may be on the verg of collaps which could plung europ into a deep freez a new studi show,scientist warn we are move closer to a total collaps of the atlant ocean current which could plung europ temperatur by 9 to 27 degre,Business Insider,2024-02-09T21:42:27Z
35,who pay,suppli and demand are alway in a danc with one outpac the other from time to time in the last three year the green tech revolut has acceler dramat countless compani are be creat to chang how food is grown peopl are transport,Seths.blog,2024-01-17T10:42:00Z
36,how much of the world is it possibl to model,dan rockmor write about mathemat modelsinclud for covid19 climat chang and artifici intelligenceand whether they have limit,The New Yorker,2024-01-15T11:00:00Z
37,there is anoth miss submers a 36 million vessel mysteri disappear near antarctica doomsday glacier,there is anoth miss submers scientist lost contact with a 36m sub revolution climat scienc near antarctica doomsday glacier,Business Insider,2024-02-07T22:00:06Z
38,7 way to deal with climat despair,here is how climateawar therapist help their client cope,Time,2024-02-06T14:33:55Z
39,2023 was hottest year ever record global us scientist confirm,last year was the hottest ever reliabl record global by a blister margin us scientist have confirm leav research struggl to account for the sever of the heat and what it portend for the unfold climat crisi from a report last y,Slashdot.org,2024-01-12T17:26:00Z
40,meet the femal forc who halt a major develop project to preserv her workingclass neighborhood and make it a leader in clean energi,elizabeth yeampierr has help preserv her neighborhood in sunset park from investor that could have push out the work class local,Business Insider,2024-01-13T10:07:01Z
41,mozambiqu storm how to cycloneproof your life,mozambican learn to build stronger hous as climat chang bring bigger and deadlier storm,BBC News,2024-01-11T00:04:52Z
42,nasa new pace observatori search for clue to human futur,they may be tini but phytoplankton and aerosol power pivot earth system scientist are about to learn a whole lot more about them at a critic time,Wired,2024-02-08T16:15:56Z
43,could uk heatwav be given name this summer,with global temperatur rise and heatwav becom more intens could name them help awar,BBC News,2024-02-01T10:42:21Z
44,the sad truth of the ftcs locat data privaci settlement,the ftc forc a data broker xmode to stop sell sensit locat data but most compani can avoid such scrutini by do the bare minimum expos the lack of protect american truli have,Wired,2024-01-16T12:00:00Z
45,the roman empir worst plagu were link to climat chang,chang in the climat may have caus disrupt to roman societi that manifest as diseas outbreak research have found,Scientific American,2024-01-26T19:00:00Z
46,rspb birdwatch 2024 fewer wild bird visit uk garden,greenfinch sparrow and starl have declin the most but other speci includ goldfinch are thrive,BBC News,2024-01-26T01:51:59Z
47,man who claim wildfir were a govern conspiraci was set them himself,brian pare 38 is a conspiraci theorist who post claim that the govern was deliber set wildfir to make peopl believ in climat chang but he was set them himself he ultim admit forc some 500 home to be evacu near ch,Boing Boing,2024-01-16T14:05:54Z
48,the feel of lose snow,a convers with zoe schlanger on the sens of loss that come when climat chang transform winter,The Atlantic,2024-01-11T23:02:00Z
49,winter sport are gnarlier than ever,climat chang social media and a pandemicera obsess with the outdoor are push athlet into danger terrain,The Atlantic,2024-01-31T19:49:33Z
50,how your old wardrob can fight climat chang serious,build a wardrob that will last longer will not get stretch out and will be of good enough qualiti that if it get a hole it will be worth repair,Vice News,2024-01-30T12:00:00Z
51,world first yearlong breach of key 15c warm limit,an anonym reader quot a report from the bbc for the first time global warm has exceed 15c across an entir year accord to the eus climat servic world leader promis in 2015 to tri to limit the longterm temperatur rise to 15c which i,Slashdot.org,2024-02-09T03:30:00Z
52,whi nasa new climat satellit is studi cloud and phytoplankton,nasa new pace satellit will studi phytoplankton in the ocean and atmospher aerosol to fill key climat data gap,Time,2024-02-05T17:47:24Z
53,can slow down save the planet,e tammi kim on the japanes philosoph kohei saito book slow down the degrowth manifesto which make the case for communism as a climatechang solut,The New Yorker,2024-02-01T11:00:00Z
54,nasa launch pace satellit to observ earth ocean and atmospher,nasa has launch it latest earthmonitor mission a satellit that studi the atmospher and the ocean as well as their relationship to climat chang,Digital Trends,2024-02-08T18:16:25Z
55,yous climat envoy john kerri is report step down from the biden administr,john kerri the yous special envoy on climat is step down from the biden administr in the come week per report,Time,2024-01-14T11:27:57Z
56,open vehicl monitor system is the window to your ev soul,electr car have more widget than ever but manufactur would rather you do not have direct access to them the open vehicl monitor system intend to chang that for the user read more,Hackaday,2024-01-26T03:00:02Z
57,cicada are come here is what we know about brood xix and brood xiii cnet,get readi for doubl the cicada buzz in 2024 depend on where you live,CNET,2024-01-22T23:00:03Z
58,rise temperatur are turn some anim nocturn,as climat chang make the planet hotter some anim might becom more activ at night to escap the midday heat,Scientific American,2024-01-31T14:00:00Z
59,wildfir scienc get a boost from worri insur compani,wildfir have upend the insur industri in part becaus climat chang is fuel bigger and more destruct blaze,Politicopro.com,2024-02-08T17:30:00Z
60,time consquenc and opportun,dream have consequ hisham matar time pass decis are made we face the consequ or enjoy the benefit a few book for this moment about navig our day and the possibl of light it bend toward justic the return by hisham matar,Seths.blog,2024-01-15T09:13:00Z
61,global renew energi growth hit 25year high,iea execut director fatih birol said renew like to increas by 25 time by 2030but that is still not enough to hit climat goal,Time,2024-01-11T14:45:41Z
62,scientist discov a surpris cool trend on glacier in mount everest 10 year ago now they think they know what is caus it,for the last 15 year local temperatur have drop on mountain like mount everest dure warmer month it could slow glacial melt scientist say,Business Insider,2024-02-06T15:12:02Z
63,i use to not worri about climat chang now i do video,comment,YouTube,2024-01-27T16:41:19Z
64,montana suprem court uphold landmark rule from youth climat case,montana suprem court reject attempt to block a rule that said regul must consid emiss when issu fossil fuel permit,Time,2024-01-17T21:25:34Z
65,if you live in a colder climat you need this power car windshield defrost now 38,tldr driver in cold climat know the inconveni caus by a chilli car and a frozen windshield but now it is easier than ever to get your car readi to move in the winter with this car windshield defrost now onli 3799 reg read the rest the p,Boing Boing,2024-01-18T16:00:00Z
66,air pollut threaten million of live now the sourc are shift,as epa tighten air pollut standard for particul matter new research suggest some compon of that pollut could worsen with climat chang,Scientific American,2024-02-08T16:30:00Z
67,the top 4 way big corpor are fuel global wealth inequ report,as corpor focus their effort on maxim sharehold profit they creat increas dire circumst for worker here is how,Business Insider,2024-01-28T14:21:17Z
68,demand for miner spark fear of mine abus on indigen peopl land,there is a grow demand for miner as the world ramp up manufactur of climat solut expert say more than half of these mine project are on or near land of indigen peopl,NPR,2024-01-29T10:00:12Z
69,whi some compani are doubl down on climat action,the market is shift and no matter what retail consum do big compani increas want to buy green,Time,2024-02-09T15:21:42Z
70,massiv amount of carbon sequest for centuri releas by clear indonesia peatland,indonesia has been clear ten of thousand of acr of dens veget peatland for farm releas massiv amount of carbon that had been sequest below for centuri report the washington post and destroy one of the earth most effecti,Slashdot.org,2024-01-28T12:34:00Z
71,scienc is use mechan moss to fight climat chang on the canari island,on the spanishnbsparchipelago of the canari islandsnbspa group of research is race to fight drought as the climat chang rapid around them theirnbspdefens is anbspnew approach to a veri veri old technolog from natur,Scientific American,2024-02-01T16:00:00Z
72,lord urg action on electr car misinform,the lord climat chang committe call on the govern to push back against mistruth on rang and cost,BBC News,2024-02-06T02:14:56Z
73,pothol report hit a fiveyear high in 2023,climat chang will worsen pothol but scientist hope new technolog will help make them a thing of the past,BBC News,2024-01-15T02:11:46Z
74,slow chang can be radic chang,rebecca solnit write in literari hub about the power and necess of slow chang i have found in my twentysometh year,kottke.org,2024-01-12T18:33:50Z
75,climat scientist michael mann confront defam in court after 12year delay,the trial come as climat impact and attack on scienc and it practition are wors than ever,Eos,2024-02-08T10:41:47Z
76,visual climat disast surpris cascad effect,see how climat disast becaus rippl effect far beyond the initi event,Scientific American,2024-01-29T15:00:00Z
77,this uk startup can captur 95 of a ship carbon emiss,like mani of us alisha fredriksson is terrifi about climat chang but unlik mani of us she is roll up her sleev and do someth about it two year ago the young entrepreneur cofound seabound a londonbas startup on a mission to decarb,The Next Web,2024-02-08T10:20:18Z
78,thousand of yous citi could becom virtual ghost town by 2100,these project find about depopul in yous citi are shape by a multitud of factor includ the declin of industri lower birth rate and the impact of climat chang,Scientific American,2024-01-11T18:15:00Z
79,climat chang threaten global forest carbon sequestr studi find,climat chang is caus western yous forest to be less effect carbon sink even as it boost the product of forest in the eastern yous accord to new research,Science Daily,2024-01-16T18:18:40Z
80,turn doctor into climat health advoc is good for patient,harvard research found that most doctor and nurs who took a cours in communiti organ believ they could help combat climat chang negat impact on health,Politicopro.com,2024-01-23T19:30:00Z
81,2024 had the hottest januari on record follow 2023s hottest year on record,2023 was the hottest year on record expert are alreadi predict 2024 will beat it extrem high temperatur,Time,2024-02-08T05:00:00Z
82,our grey swan climat crisi nonlinear predict and unpreced,zoe schlanger write for the atlant prepar for a gray swan climat the way to think about climat chang now is through t,kottke.org,2024-01-26T22:26:54Z
83,alphabet moonshot x lab cut staff,alphabet lab for pioneer technolog is lay off dozen of employe as it turn to outsid investor to help fund it ventur from a report the divis known as x has in recent month ramp up discuss on fund with ventur capitalist and,Slashdot.org,2024-01-22T21:20:00Z
84,juri award climat scientist michael mann 1m in defam lawsuit,a juri on thursday in washington dc said climat scientist michael mann was defam 12 year ago when a pair of conserv writer compar his depict of global warm to a convict child molest the juri award him 1 million mann a professor,Associated Press,2024-02-09T14:53:06Z
85,exxon take activist to court over emiss propos,exxon mobil has file a complaint in a texa court seek to block a climat propos by activist investor from a sharehold vote in may this mark exxon first legal action against such a propos exxon argu the propos which urg adopt of emi,Slashdot.org,2024-01-22T18:40:00Z
86,how are atmospher river affect by climat chang,california is in the grip of an atmospher river that is caus flood all over the state climat chang might be intensifi storm like it but scientist are still work out the detail,NPR,2024-02-06T10:00:48Z
87,climat concern grow nationwid even in some republican state,a nation survey show american are increas worri about global warm but partisan polit continu to drive a wedg between red and blue state,Politicopro.com,2024-01-24T17:30:00Z
88,what is the pineappl express and whi has it drench california,the record rain pound california is part of a common weather pattern,BBC News,2024-02-06T17:30:15Z
89,new nasa earth scienc mission could chang the way we see our planet,nasa pace mission aim to increas our understand of earth carbon cycl pollut particl and ocean plankton,Politicopro.com,2024-02-05T20:00:00Z
90,world largest carbon captur plant is uk next big white eleph,in a move that has spark widespread critic from scientist and politician alik the uk govern has approv plan to instal carbon captur technolog at britain largest power plant under the plan power generat drax will instal socal bio,The Next Web,2024-01-18T12:23:12Z
91,lawmak are tri to keep meatpack giant jbs from trade on nyse cite link to deforest,a bipartisan group of lawmak along with environment group say they fear more environment harm if jbs gain access to addit capit,Business Insider,2024-01-18T23:28:37Z
92,ai climat impact may hit margin peopl hardest,a brook institut report warn that energyhungri artifici intellig tech will worsen the climat crisi,Politicopro.com,2024-01-31T21:45:00Z
93,beyond the doom and gloom here is how to stimul climat action,a gloom and doom approach doe not alway spur climat action it turn out a new studi tell you when it work and when it doe not,Scientific American,2024-02-08T12:00:00Z
94,siberia mysteri explod crater may be caus by hot gas,sever enorm crater left by explos have been spot in siberia over the past 15 year and a new explan link them to hot gas and climat chang,New Scientist,2024-01-15T08:00:20Z
95,climat activist greta thunberg on trial in london for block oil gas confer,climat activist greta thunberg is on trial for protest outsid a major oil and gas industri confer in london last year,ABC News,2024-02-01T13:42:38Z
96,california climat has come unmoor,the weather of catastroph is here,The Atlantic,2024-02-07T17:29:10Z
97,climat chang is make it harder for tree to breath,a new studi highlight just how much climat chang is affect our tree accord to new research which was recent publish in proceed of the the post climat chang is make it harder for tree to breath appear first on bgr,BGR,2024-02-03T15:33:00Z
98,live through the end of california,in a new book manjula martin face up to the way the alter environ of her home state will chang her life forev,The Atlantic,2024-02-02T14:12:27Z
99,big tech ces 2024 sustain goal more recycl materi longer lifespan cnet,tech compani are feel more pressur to adopt more impact sustain strategi,CNET,2024-01-13T13:00:11Z
